{
  "reference_candidate_catalog_version": 1,
  "catalog_id": "uibowl-representative-candidates-20260922",
  "prepared_on": "2026-09-22",
  "status": "discovery-only",
  "authority_scope": "non-authoritative-discovery-index",
  "audience": [
    "internal-researcher",
    "independent-critic",
    "owner"
  ],
  "source_provider": "uibowl",
  "source_pixels_included": false,
  "source_assets_included": false,
  "creator_input_approved": false,
  "visual_authority_granted": false,
  "design_ready": false,
  "rights": {
    "scope": "Source links and original research summaries only; not a screenshot license or cross-project reuse grant.",
    "source_notice_url": "https://uibowl.io/",
    "redistribution": false,
    "creator_pixel_access": false,
    "cross_project_approval_reuse": false
  },
  "limits": [
    "Entries are discovery candidates, not verified references, ready packs or universal design answers.",
    "Historical observations retain their dates; no source frame was freshly inspected during catalog preparation.",
    "The 24-product study does not retain per-product frame closure. Never divide its 48-screen total into invented per-product evidence.",
    "Frame links preserve historical identifiers but are not local capture bytes or content hashes. A source URL can change.",
    "Family/component tags are research indexing hypotheses, not evidence-backed product-fit ratings or extracted component recipes.",
    "Popularity was not revalidated; do not rank candidates by guessed counts or turn unknown into zero.",
    "No source interaction, responsive transition, font, exact color, CSS value or accessibility behavior is certified by this catalog.",
    "No private project captures, login data, selection, approval or source authority are imported.",
    "Source-brand names and these notes are for research/Owner use, never a downstream creator prompt.",
    "Public page text may be cached and may omit gated or client-rendered frames. Login in that text says nothing about the user's browser session."
  ],
  "studies": [
    {
      "id": "study-20260904",
      "observed_on": "2026-09-04",
      "path": "docs/research/ui-bowl-popular-design-study-2026-09-04.md",
      "digest": "sha256:8a568e34dc0f41dc4d8d2d27ccae1a7bf3b5f6606da99c19901cca3ee4c37952",
      "frame_index_path": null,
      "frame_index_digest": null,
      "source_captures_included": false
    },
    {
      "id": "study-20260910",
      "observed_on": "2026-09-10",
      "path": "docs/research/ui-bowl-task-design-study-2026-09-10.md",
      "digest": "sha256:aa15fa6453f72e2cb041b1ceb736db1ec4d180e14e5c53bdf475f7ce759a87c4",
      "frame_index_path": "docs/research/ui-bowl-task-design-samples-2026-09-10.json",
      "frame_index_digest": "sha256:b76bf5d6862a65c3ccafbd04b39b400828d526f30e46f5ba4984eb0ffb5bad81",
      "source_captures_included": false
    }
  ],
  "families": [
    {
      "id": "news-reading",
      "label": "뉴스·피드·본문 읽기",
      "job": "주요 소식을 훑고 원문·시각·출처를 확인한다.",
      "component_families": [
        "feed-row",
        "reader-detail",
        "source-preview",
        "topic-filter"
      ],
      "research_states": [
        "중요순/시간순 구분",
        "출처와 시각",
        "장문/빈 목록/중복",
        "모바일 읽기"
      ],
      "catalog_coverage": "gap",
      "discovery_queries": [
        "앱 콘텐츠 > 목록/뷰어",
        "뉴스 본문 미리보기, 연대순 목록, 출처 링크"
      ],
      "discovery_route_ids": [
        "app-content",
        "app-viewer"
      ]
    },
    {
      "id": "knowledge-search",
      "label": "지식·문서·근거 검색",
      "job": "질문으로 찾고 문서의 근거와 최신성을 판별한다.",
      "component_families": [
        "search-results",
        "evidence-panel",
        "document-reader",
        "breadcrumbs"
      ],
      "research_states": [
        "검색 없음/일부 일치",
        "원문 근거/갱신시각",
        "문서 계층",
        "키보드 탐색"
      ],
      "catalog_coverage": "gap",
      "discovery_queries": [
        "웹 콘텐츠 > 검색/뷰어",
        "문서 검색, 근거 펼치기, 읽기 복귀"
      ],
      "discovery_route_ids": [
        "web-search",
        "web-content"
      ]
    },
    {
      "id": "comparison",
      "label": "조건·가격·후보 비교",
      "job": "같은 축의 값·조건·불확실성을 비교한다.",
      "component_families": [
        "comparison-table",
        "result-card",
        "filter-bar",
        "selection-slot"
      ],
      "research_states": [
        "empty/partial/filled",
        "가격과 조건",
        "긴 한글·단위",
        "모바일 비교 축"
      ],
      "catalog_coverage": "historical-only",
      "discovery_queries": [
        "비교하기 > 금융/여행",
        "테이블, 정렬, 후보 선택"
      ],
      "discovery_route_ids": [
        "web-comparison"
      ]
    },
    {
      "id": "operations",
      "label": "업무·운영·다중 작업공간",
      "job": "대상·범위·상태를 잃지 않고 다음 업무를 고른다.",
      "component_families": [
        "sidebar",
        "tabs",
        "work-card",
        "state-badge",
        "empty-state"
      ],
      "research_states": [
        "신규/운영 중/미승인",
        "작업공간 전환",
        "고밀도 데이터",
        "권한 상태"
      ],
      "catalog_coverage": "historical-only",
      "discovery_queries": [
        "대시보드 > 비즈니스툴",
        "사이드 네비게이션, 상태별 목록"
      ],
      "discovery_route_ids": [
        "web-dashboard"
      ]
    },
    {
      "id": "analytics",
      "label": "수치·현황·원인 탐색",
      "job": "결론과 분모를 읽고 원인 근거로 좁혀 간다.",
      "component_families": [
        "metric-summary",
        "data-table",
        "chart",
        "evidence-panel"
      ],
      "research_states": [
        "0과 누락 구분",
        "기간/비교 기준",
        "분모/상세 진입",
        "빈/부분 데이터"
      ],
      "catalog_coverage": "historical-only",
      "discovery_queries": [
        "통계·리포트, 그래프&차트",
        "수치에서 근거로 이동"
      ],
      "discovery_route_ids": [
        "web-report"
      ]
    },
    {
      "id": "commerce",
      "label": "구매·장바구니·결제",
      "job": "상품과 최종 조건을 확인하고 주문을 확정한다.",
      "component_families": [
        "product-card",
        "cart-row",
        "price-summary",
        "checkout-form"
      ],
      "research_states": [
        "품절/수량/할인",
        "비용·배송·취소",
        "결제 오류",
        "터치/키보드"
      ],
      "catalog_coverage": "historical-only",
      "discovery_queries": [
        "장바구니, 예약·결제",
        "이미지 상품 카드, 수량/합계"
      ],
      "discovery_route_ids": [
        "app-cart"
      ]
    },
    {
      "id": "maps-travel",
      "label": "장소·여행·지도",
      "job": "공간적 맥락을 유지하며 장소와 조건을 선택한다.",
      "component_families": [
        "map-sheet",
        "place-card",
        "itinerary",
        "result-card"
      ],
      "research_states": [
        "지도↔목록",
        "위치 권한/없는 결과",
        "가격/시간/조건",
        "재방문 연속성"
      ],
      "catalog_coverage": "historical-only",
      "discovery_queries": [
        "지도뷰·내주변, 여행",
        "조건이 함께 있는 장소 상세"
      ],
      "discovery_route_ids": [
        "app-map"
      ]
    },
    {
      "id": "conversation",
      "label": "대화·커뮤니티",
      "job": "대상·맥락·신뢰를 확인하며 읽고 답한다.",
      "component_families": [
        "conversation",
        "composer",
        "context-header",
        "permission-row"
      ],
      "research_states": [
        "긴 메시지",
        "키보드 열린 모바일",
        "차단/전송 실패",
        "실제 다중 권한 상태"
      ],
      "catalog_coverage": "historical-only",
      "discovery_queries": [
        "채팅, 커뮤니티",
        "대화의 대상과 다음 행동"
      ],
      "discovery_route_ids": [
        "app-chat"
      ]
    },
    {
      "id": "creation",
      "label": "제작·편집·미디어 도구",
      "job": "입력과 결과를 비교하며 안전하게 편집·내보낸다.",
      "component_families": [
        "editor-toolbar",
        "output-preview",
        "parameter-form",
        "work-card"
      ],
      "research_states": [
        "저장 전/후",
        "비용/출력 조건",
        "초심자와 숙련자",
        "빈 입력/실패/재시도"
      ],
      "catalog_coverage": "historical-only",
      "discovery_queries": [
        "편집·수정하기, 생성하기",
        "미리보기, 도구모음, 생성 결과"
      ],
      "discovery_route_ids": [
        "web-edit"
      ]
    },
    {
      "id": "learning",
      "label": "학습·진행·피드백",
      "job": "한 단계를 이해하고 피드백으로 다음을 결정한다.",
      "component_families": [
        "progress",
        "choice-control",
        "feedback-layer"
      ],
      "research_states": [
        "정답/오답/중단",
        "진행과 과제",
        "반복 학습",
        "오디오/키보드 대안"
      ],
      "catalog_coverage": "historical-only",
      "discovery_queries": [
        "교육&도서, 학습하기",
        "단계별 피드백"
      ],
      "discovery_route_ids": [
        "app-education"
      ]
    },
    {
      "id": "health",
      "label": "건강·자기 기록·신뢰",
      "job": "현재 상태와 다음 행동을 이해한다.",
      "component_families": [
        "daily-summary",
        "chart",
        "record-form",
        "context-header"
      ],
      "research_states": [
        "0/미기록/미연결 구분",
        "기록과 해석 분리",
        "민감정보",
        "글자 확대"
      ],
      "catalog_coverage": "weak",
      "discovery_queries": [
        "운동&건강, 의료",
        "기록, 통계, 위험 안내"
      ],
      "discovery_route_ids": [
        "all-taxonomy"
      ]
    },
    {
      "id": "forms-permissions",
      "label": "입력·설정·승인·권한",
      "job": "입력·동의·보관·외부 반영을 구별한다.",
      "component_families": [
        "choice-control",
        "permission-row",
        "form-preview",
        "tabs"
      ],
      "research_states": [
        "초안/확정",
        "다중 값 권한",
        "오류 복구",
        "미승인/접근 제한"
      ],
      "catalog_coverage": "historical-only",
      "discovery_queries": [
        "온보딩, 약관동의, 설정",
        "입력과 결과, 동의, 검토"
      ],
      "discovery_route_ids": [
        "web-onboarding"
      ]
    },
    {
      "id": "expressive",
      "label": "개성·브랜드·감성적 발견",
      "job": "탐색의 속도와 분위기를 제품 목적에 맞춘다.",
      "component_families": [
        "image-card",
        "conversation",
        "context-header"
      ],
      "research_states": [
        "콘텐츠 주도/도구 주도 대조",
        "표현과 경고 분리",
        "작은 화면 가독성",
        "동작 줄이기"
      ],
      "catalog_coverage": "historical-only",
      "discovery_queries": [
        "콘텐츠, 심리, 커머스",
        "사진/캐릭터/재질의 역할"
      ],